Article,Finetuned_DistilBert_FinancialPhaseBank,FinBert_Sentiment,Grok_Sentiment,Human_Sentiment,Finetuned_DistilBert_FinanceSentimentDataset
"Kia Americas COO says business rules like tariff strategy won't dictate where the company makes its cars.Korean automaker Kia 000270.KS, is killing it. Kia America, part of the Hyundia Motor Group, reported another record sales month in February, powered by its mix of gas powered offerings like the high-selling Telluride SUV, as well as EV vehicles like the EV6 crossover. So our grand strategy is, first, we want to be a leader in what we call sustainable mobility. This is key, is mission, and EVs are part of that, and also includes electrified internal combustion, which is hybrids and plug in hybrids and so on, Steven Center, Kia Americas COO & EVP told Yahoo Finance. But we we've also built out a very full lineup of internal combustion vehicles in the past few years. Center mentions the aforementioned three-row Telluride, as well as the Sorrento and other smaller SUVs. The company didn’t abandon sedans — like its Big Three rivals did — and just introduced the midsize K4 last year. The larger K5 is actually built in North America.A big part of the growth plans for Kia include localizing production in the US, which it has done for many years. Kia intends to move its EV production stateside as well. We're going to be building EVs in Georgia, and that's before any of this tariff talk. Kia has been in the United States for over 30 years now, and we've invested as a company, billions and billions and billions of dollars in American manufacturing and supply chain, Center said. So this is part of a plan weve had for a long time. Officially, Kia addressed the 800-pound gorilla in the room —Trumps auto tariffs — by stating the company is monitoring tariff developments and will be reviewing business strategies in response. But — and this is a big but — the White House hasn’t targeted vehicles made in South Korea, where Kia is based and still imports vehicles in the US.Ford CEO Jim Farley has been howling that not targeting other international imports with tariffs is unfair because international automakers like Kia are essentially getting a free ride, whereas imports from Mexico and Canada — also part of a free trade agreement — are slated for 25% duties starting April 2. Unfair or not, it’s likely only a matter of time before other trade partners are targeted by the administration, and Center believes Kia has a good game plan if that happens, because of its large US footprint. [Tariffs] will affect every brand differently depending on their balance of what they make where. So in our case, and weve had plenty of meetings about this in the past few months, weve got our business plan, and were going to continue to work that plan to the best advantage of our customers, our dealers — who are also customers who have big investments in Kia — and to hit the volume levels, we want to keep growing [in the US].Center added: Were not chasing business rules, were doing what we think is the right thing for Kia, and thats building as many cars as we can here. Building EVs is next on the agenda at Hyundai and Kia’s joint plant in Bryan County, Georgia. The company touts the 0.5 billion it has spent in the US on its domestic production facilities, which it says employ over 570,000 workers. At Kia’s big Kia Day event in Portugal late last month, the automaker unveiled a number of new vehicles, including the EV4, a sporty EV sedan that also comes in hatchback form. Center believes cars like the EV4 will only grow the company’s sales and not cannibalize other similar vehicles like the gas-powered K4 or larger EV6 midsize crossover; these will be net incremental volume, he says, meaning its sales will be additional sales over and above what Kia normally would get. It remains to be seen if sales aren’t cannibalized, as they have been at other manufacturers who offer similar products with differing drivetrains. On the flip side, a wide availability of powertrains may expand sales, bringing new customers to fold. Center believes Kia’s plan of offering a wide product portfolio is the right one for the US. Looking big picture, despite economic jitters coming from tariffs, and concerns of an possible ensuing economic slowdown in the US in 2025, Center and Kia see growth in the cards. So we think the market is going to be good. If there aren't too many shocks to the system, we'll we'll have another record year. We're planning for that, Center said.",positive,positive,positive,positive,neutral
"After Warren Buffett sold 34 billion in equities in 2024 and is sitting on a 34 billion cash pile, one analyst said the Oracle of Omaha saw the current selloff coming. While it's unlikely Buffett will make any big moves during the current market turmoil, some think he’ll look internationally or round out his insurance business. Amid the stock market selloff, Berkshire Hathaway CEO Warren Buffett’s recent capital movements suggest he was preparing for it, according to an analyst. After tumbling more than 10% from its last peak, the Nasdaq remains in correction territory. The S&P 500 also entered a correction, though Friday’s rally pared its decline to less than 10% from its all-time record. That has highlighted Berkshire’s recent cash hoarding as especially prescient. When asked if Buffett saw the selloff coming, Armando Gonzalez, founder of AI-powered research platform Bigdata.com, said the evidence suggests he did. “Buffett’s actions over the past year have been a textbook example of positioning for turbulence, he said in an emailed response to questions from Fortune. Berkshire sold 34 billion in equities in 2024, ending the year with a cash pile of 34.2 billion—nearly double from a year ago and more than its shrinking stock portfolio of 72 billion. Gonzalez also noted that Buffett’s recent comments have been riddled with caution, emphasizing inflationary concerns and geopolitical uncertainty. For example, he warned that President Donald Trump’s tariffs will cause prices to rise. History shows when Buffett turns net seller, he often anticipates a period of subpar market performance, Gonzalez said. And once again, the Oracle of Omaha seems to have been ahead of the curve. With stocks well off their highs, that begs the question: will the famously value-conscious Buffett start deploying his cash by making some big purchases? To be sure, Berkshire has made some moderate stock buys. But preferring bargains, Buffett historically looks to invest heavily in companies when valuations are low. During the peak of the 2008 financial crisis, for instance, Buffett deployed  billion into General Electric whose stock price had nosedived. In his latest letter to Berkshire shareholders, Buffett reiterated his years-long view that valuations remained high. Gonzalez said it’s possible Buffett could start buying but only if true bargains emerge, noting that his track record shows a deep aversion to haste, even when markets tumble. He has no interest in timing the market’s bottom, nor does he chase short-term rebounds, he said. Instead, he waits for moments when fear drives prices to levels where the risk-reward equation tilts decisively in his favor. If Buffett should choose to finally make a big purchase, Gonzalez expects his next move to be used with a scalpel rather than a broad-market splash, if any at all. In Buffett’s world, patience is more than a virtue, it's a weapon, he added. While it's uncertain if Buffett will go forward with a deal during the current market selloff, CFRA Research’s Cathy Seifert told Fortune she wouldn’t be surprised if Berkshire rounded out its insurance holdings. She added that valuations are still not dirt cheap, while the cash Buffett has parked in Treasury bonds is yielding him a good return and the competitive environment for deals has changed. Additionally, Buffett has shown keen interest in Japanese trading companies, suggesting a growing appetite for international diversification, Gonzalez said. Since 2019, Berkshire has invested in the five biggest Japanese sogo shosha, which invest across sectors domestically and abroad. The trading houses—Itochu, Marubeni, Mitsubishi, Mitsui, and Sumitomo—operate “in a manner somewhat similar to Berkshire itself, Buffett wrote in his annual letter. While Buffett sits on his pile of cash, his deployable funds may grow even more as rumors of a rare Berkshire sale circle. The Wall Street Journal reported that real-estate brokerage Compass was in advanced talks to acquire Berkshire Hathaway’s HomeServices of America. According to Berkshire’s annual report, HomeServices has 820 brokerage offices and 270 franchisees in 2024. Berkshire Hathaway did not return Fortune’s request for comment.",positive,positive,neutral,neutral,neutral
"Docusign's (DOCU) business remains brisk despite a bruised stock market and rising concerns of an economic growth slowdown in the US. CEO Allan Thygesen said on Yahoo Finance's Morning Brief on Friday that demand trends in February remained solid. As I looked at our February numbers, for example, our transaction volumes were pretty much on target with what we had expected — not seeing any major impact there, Thygesen said. So at this point, we haven't seen any impact of the recent volatility. Docusign reported on Thursday evening that fourth quarter earnings came in better than expected as more customers adopted its AI agreement technology. The momentum in the business appears to have legs as the company's billings guidance surprised Wall Street estimates to the upside.Shares of the software play rose more than 16% in Friday morning trading. The stock was the No. 1 trending ticker on Yahoo Finance. We maintain our positive view as we see potential for continued international expansion, IAM [intelligent agreements] optionality in FY26, and operating leverage in future years, Citi analyst Tyler Radke wrote. Radke reiterated a Buy rating on Docusign's stock. Earnings analysis: A clean quarter of beats Fourth quarter net sales: +9% year over year to 76.3 million, vs. estimates for 61.5 million Billings: +11%% year over year to 23.2 million, vs. estimates for 63.8 million Diluted earnings per share: +13.2% year over year to.86, vs. estimates for .85 Earnings guidance: mixed, but stock trading off billings upside First quarter: Sales: 45 million to 49 million vs. estimates for 57.2 million Billings: 41 million to 51 million vs. estimates for 44.2 million Full year: Sales: .13 billion to .14 billion vs. estimates for .15 billion Billings: .3 billion to .35 million vs. estimates for .22 billion What else caught our attention: Repurchases say a lot Gross profit margins dropped to 82.2% from 82.6% in 2024. Docusign repurchased 83.5 million in stock versus 45.5 million in the same period last year. It reported a strong .1 billion in cash.",positive,negative,positive,positive,positive
"Gold made the sprint to ,3000 $ on Friday as uncertainties about the economy and an escalating trade war drove up demand for the safe-haven asset. Gold (GC=F) futures rose to hover above ,008 per ounce while spot gold reached above ,001.The precious metal was on track for a second straight week of gains amid new data indicating moderating inflation and the announcement of retaliatory tariffs from the United States' trading partners. Though it feels like a psychological threshold, gold at ,000 might just be a stepping stone if trade wars deepen, said Tony Redondo, founder of Cosmos Currency Exchange. That said, it’s not all about Trump. Central banks, interest rate bets, geopolitical tensions, and inflation concerns are all stoking the flames. Read more: How to invest in gold in 4 steps Trade tensions grew this week after President Trump threatened 200% tariffs on wine and spirit imports from Europe on Thursday. The threat followed the EU's announcement of retaliatory tariffs after the US put a 25% duty on steel and aluminum. Gold is up more than 12% year to date after making multiple record highs in recent months. All eyes are on how gold continues to play a role as a safe haven asset, said Joe Cavatoni, market strategist at the World Gold Council. With rising inflation expectations, lower rates, and continued uncertainty, we continue to see support for gold looking ahead.Wall Street has been playing catch-up by raising price targets to keep pace with gold's rise. In a note on Thursday, Macquarie Group predicted the precious metal will touch ,500 in the third quarter. Year-to-date, gold has been running ahead of our expectations, wrote Marcus Garvey, head of commodities strategy at Macquarie. We are raising our gold price forecast to a 3Q25 quarter average peak of ,150 per ounce and our single point price high to ,500 per ounce, he added. Wall Street strategists have attributed much of these gains to continued central bank buying and tariff uncertainty, including the possibility that even imports of the precious metal into the US won't be spared. Institutional investors have shipped elevated amounts of physical gold bars to vaults in New York in a move to front-run tariffs and take advantage of a price disparity between London and New York.",positive,positive,positive,neutral,neutral
"Republican Sen. Ted Cruz supports President Trump's use of tariffs, just not for the long term. I fully support the president using the threat of tariffs to incentivize Mexico and Canada to help secure the border. Now that being said, my home state of Texas does an enormous amount of trade with Mexico and Canada. I don't want to see the long-term economic policy being big tariffs against Mexico and Canada, Cruz told me on Yahoo Finance's Opening Bid podcast (video above; listen below). And so my hope is that those policies stay as an incentive rather than an ongoing feature of economic policy.The president has paused 25% duties on Canadian and Mexican imports that comply with the United States-Mexico-Canada agreement (USMCA). But Trump on Wednesday hit Canada with 25% tariffs on steel and aluminum, backing off a floated 50% duty. On Thursday, Trump said that if the European Union didn't remove a 50% tariff on whiskey, the US would place a 200% tariff on wine, champagne, and other alcoholic products. Read more: What Trump's tariffs mean for the economy and your wallet Trump has implemented a second round of 10% duties on Chinese imports after instituting 10% in February. The targeted countries wasted no time hitting back. China unveiled a 15% tariff on US chicken, wheat, corn, and cotton products and an additional 10% tariff on sorghum, soybeans, pork, beef, seafood, fruits, vegetables and dairy products. The new tariffs from China began on Monday. Canada announced a 25% tariff on 30 billion Canadian dollars of US imports. As for Cruz, there is a lot at risk for his home state of Texas after brisk 3.9% GDP growth in 2024. Mexico has been Texas's biggest trade partner for the past 16 years. Texas's top imports from Mexico include electric machinery, sound and TV equipment, various fuels, and medical and surgical equipment. Texas houses about one-third of US refining capacity and refines crude oil imported from Canada and Mexico. Businesses in the state may already be wary of the tariff pinch. The latest Dallas Fed survey for February saw its production index — a barometer of state manufacturing conditions — plunge 21 points from January. The new orders index fell 11 points and the capacity utilization index declined 14 points. Perceptions of broader business conditions worsened in February too. It's clear in the next four years, we will see more tariffs than we had the previous four years, Cruz said. What I've urged him [the president] is two things. No. 1, focus on China. I have said for a long time that China poses the greatest geopolitical risk to the United States over the next hundred years. And so I want to see our economy delink from China. And then secondly, what I've urged the president to do is focus on reciprocity, he explained. And the virtue of reciprocity is if President Trump imposes tariffs on a foreign country and the foreign country doesn't like those tariffs, they already have a solution to that, which is lower the tariffs they're putting on US goods.Investors have reacted harshly this month to the flurry of tariff headlines. The S&P 500 (GSPC) fell 1.4% on Thursday, the 10th daily decline this year with a loss above 1% according to data from Creative Planning chief markets strategist Charlie Bilello. Last year, at this point, the S&P 500 had only three big down days, which Bilello said was abnormally low. The S&P 500, Dow Jones Industrial Average (^DJI), and Nasdaq Composite (^IXIC) are each down by about 5% in March.Some of the market's often most popular stocks, such as Nvidia (NVDA), Tesla (TSLA), and Palantir (PLTR), have seen pullbacks of more than 10% from their 52-week highs. Wall Street recession calls have begun to creep into the picture too. Well, look, there's no doubt there has been some uncertainty, Cruz said. When I talk to business leaders, the most consistent question I get from them is what's going to happen on the tariff front? So I understand that uncertainty, and I think it'll take some time to have a clearer picture of what the exact tariff landscape is going to look like.",negative,negative,negative,negative,negative
"Some of the biggest bosses on Wall Street aren't hitting the panic button on President Trump's policies this week despite the recent gyration in markets, even as they acknowledge some new concerns from the business world. Blackstone BX CEO Steve Schwarzman said earlier this week that US tariffs will produce more manufacturing in the United States at the end of the day, and given the size of the US, that tends to be a good thing for the world. Goldman Sachs GS CEO David Solomon said Wednesday, I think the business community understands what the president is trying to do with tariffs, even if executives do want lower tariffs everywhere. BlackRock BLK CEO Larry Fink said Wednesday that while he does hear from CEOs that the economy is weakening as we speak, he predicts that if we are able to unlock private capital ... that will restart and rekindle the next wave of a bull market.Wall Street certainly has a lot riding on Trump 2.0. At the beginning of the year, bankers were wildly optimistic that the Trump administration’s pro-growth agenda and deregulatory stance would unleash the market’s animal spirits and spur a flurry of US deals. But the uncertainty surrounding the administration's trade policies is roiling markets and raising new concerns about the direction of the US economy and inflation. That is making it more challenging for bankers and executives to know how trade changes could affect their supply chains or if they should pull the trigger on a public listing or a merger. At the beginning of this week, Goldman Sachs GS became the first major Wall Street firm to lower its year-end price target for the S&P 500 GSPC, after the major index tumbled into near-correction territory and the firm reduced its outlook for GDP. Though less bullish than the major bank initially expected, the new forecast is still optimistic — it's 11% higher than the index’s all-time high set in February. Solomon said Wednesday on Fox Business Network's Mornings with Maria that he still expects a pickup in certain deals this year. The level of uncertainty is a little bit higher, and that has kept some possible transactions on the sidelines, but the overall level of dialogue, as people are thinking strategically about where they want to drive their businesses, is certainly increasing.There is potential, especially if we got more specific actions on the regulatory front, to unleash more animal spirits, he added. Trump did make an effort this week to speak directly to Solomon and some of the other top CEOs at a meeting of the Business Roundtable in Washington, D.C. Read more: What Trump's tariffs mean for the economy and your wallet There's a renewed spirit, the president told the executives, adding that the tariffs are going to be throwing off a lot of money to this country. During a portion of the meeting closed to the press, Trump laid out other parts of his agenda — including extending the corporate tax cuts, speeding up approvals on environmental projects, and bringing more jobs and plants back to the US, according to a person familiar with the remarks.The next day, one attendee, JPMorgan Chase JPM CEO Jamie Dimon, downplayed the effect tariffs thus far may be having on consumer sentiment. I don't think the average American consumer who wakes up in the morning and goes to work, which there are like 175 million of them, changes what they're going to do because they read about tariffs, Dimon said in an interview with a Semafor reporter at a Washington, D.C., event hosted by BlackRock and the Bipartisan Policy Center. But, he added, in a nod to some unease in the business world, I do think companies might. Uncertainty is not a good thing. Since Trump took office, Dimon has, in some measure, applauded the Trump administration's efforts to cut down on Washington, D.C.'s bureaucracy and publicly rebuked tariff worries without delivering an outright judgment on whether the cost-cutting efforts or trade policies have gone too far.Days into Trump's second term, Dimon said of tariffs, If it's a little inflationary, but it's good for national security, so be it. I mean, get over it,while speaking with CNBC at the World Economic Forum in Davos, Switzerland. He made similar points on March 7 during a talk at Stanford University, calling the current impact of tariffs very modestly inflationary and said the effect on that part of the economic picture was being blown out of proportion. However, he acknowledged scenarios where the impact could be bigger. Now, if you put 25% tariffs on all imports, okay, that's a lot more. That could be, in my viewpoint, recessionary and inflationary, Dimon added. Read more: What is a recession, and how does it impact you? Fink, who runs the world's largest money manager, has already shown that his company's moves can align with the priorities of the Trump administration. It came last week when a BlackRock-led coalition struck a 2.8 billion deal with Hong Kong-based conglomerate CK Hutchison that included taking control of two ports located on either end of the Panama Canal.The move gave Trump what he asked for on his first day in office — a larger American presence in a crucial shipping lane where he had alleged Chinese interference. Fink himself cleared the deal with Trump and other White House officials, according to Bloomberg and the Wall Street Journal. This week, Fink offered optimism even amid some uncertainty. The world economies, over a long cycle, are going to be fine, Fink said Monday at an event in Houston. On Tuesday he told CNN: Could we have one quarter or two quarters of a flattening of our economy as we try to reset the economy? Absolutely. But, he added, Trump's policies, including tariffs, can be very productive for the United States in the long run. As for market losses this week, he said there’s nothing wrong with a market pullback. I look at that as a buying opportunity because I'm very bullish on America.",positive,positive,positive,positive,neutral
"SHANGHAI ((Reuters)) - China's securities watchdog will step up monitoring fake information in the stock market and work with the police and cyberspace regulators to crack down on those who disseminate false news, which is being made easier by AI, official media reported on Saturday. Regulators will hit early, hit hard, and hit at the heart of the issue, the Securities Times said. Artificial intelligence has become a new tool for creating and spreading misleading information to con investors or manipulate stocks, luring investors with the prospect of getting rich quickly, the Shanghai Securities News said in a separate article. The rise of Chinese AI company DeepSeek has driven retail investors and fund managers to embrace AI to help them evaluate companies and invest, but their adoption of the technology also raises risks they will become vulnerable to fake news created by artificial intelligence. The Securities Times said the China Securities Regulatory Commission would be more pro-active in dispelling stock market rumours by issuing clarifications and would strengthen investor education and guidance to enhance investors ability to spot fake information. The reports by the Securities Times and the Shanghai Securities News coincide with the March 15 annual World Consumer Rights Day, which has become a major television and social media event in China to promote consumer protection.",positive,neutral,negative,negative,neutral
