Article,Finetuned_DistilBert_FinancialPhaseBank,FinBert_Sentiment,Grok_Sentiment,Human_Sentiment,Finetuned_DistilBert_FinanceSentimentDataset
"The stock sell-off resumed Thursday after a mild respite in the prior session. Major indexes traded lower as Trump threatened more tariffs on imports from Europe. The tariff noise drowned otherwise upbeat news of back-to-back tame inflation reports. The market got two surprisingly tame inflation readings this week, but the upbeat data is getting drowned out by more trade war noise from the White House on Thursday. Stocks slid a day after investors got a mild boost from a cooler-than-expected consumer inflation report on Wednesday. Wholesale inflation was also less than expected, with the producer price index flat in February compared to expectations for it to increase. But, Trump keeps escalating his trade war, with the president rattling markets again on Thursday with a post on Truth Social that said he would slap a 200% tariff on all wines, champagne, and other alcohol imports from the EU if the bloc didn't repeal a 50% tariff on US whisky exports. Meanwhile, Treasury Secretary Scott Bessent reiterated the administration's position that it is willing to tolerate market volatility as it pursues policies meant to boost the broader economy. We're focused on the real economy. Can we create an environment where there are long-term gains in the market and long-term gains for the American people? Bessent said on CNBC. I'm not concerned about a little bit of volatility over three weeks. All three major indexes traded lower on Thursday. Long-dated bond yields also climbed higher. Here's where indexes stood around 10:30 a.m. ET: S&P 500: 5,584.66, down 0.26% Dow Jones Industrial Average: 41,269.28, down 0.06% (-81.65 points) Nasdaq composite: 17,521.12, down 0.71% 10-year US Treasury yield: 4.335% (+1 basis point) While Trump's new tariff target is a relatively small portion of all EU imports, it's another sign of a spiraling trade war for investors, who just endured a  trillion sell-off in stocks as Trump pushed ahead with his latest round of tariffs on Canada, Mexico, and China. The news was enough for stock traders to brush off the latest PPI reading, which showed that producer prices remained flat in February, down from the 0.3% growth that economists were expecting. The figures came out after CPI showed that consumer prices rose a less-than-expected 2.8% year-over-year in February.The economy entered 2025 with a downward inflation trajectory. However, the outlook for inflation depends more on tariffs, deportations, and DOGE than the backward-looking data releases right now, Bill Adams, the chief economist at Comerica Bank, said in a note. Traders may also be discounting the cool inflation data as tariffs, which economists have warned could stoke higher prices, haven't yet impacted inflation numbers yet, according to Chris Zaccarelli, chief investment officer at Northlight Asset Management. Clearly this is going to be a much more volatile year and it remains to be seen if all of the revolutionary changes to the economy and trans-Atlantic alliances will lead to a recession or if it will lead to higher growth rates in the future, but in the meantime a more cautious and risk-off posture is warranted, Zaccarelli said in a note on Thursday.",negative,negative,negative,negative,negative
"NEW YORK (AP) — The U.S. stock market has just dropped 10% from its high set last month, hurt by worries about the economy and a global trade war. The fall for the S&P 500 is steep enough that Wall Street has a name for it: a “correction.” Such drops have happened regularly for more than a century, and market pros often view them as potentially healthy wipeouts of overdone euphoria, which could send stock prices too high if unchecked. But corrections are frightening in the moment, particularly for every new generation of investors that gets into the market at a time when it seems like stocks only go up. The S&P 500 is coming off two straight years with gains of more than 20%. Such stellar gains left the market looking too expensive to critics, who pointed to how prices rose faster than corporate profits. Culling too-high enthusiasm among day traders is one thing. The larger fear always accompanying a correction is that it could be a warning sign of a coming bear market, which is what Wall Street calls a drop of at least 20%. Here’s a look at what history shows about past corrections, and what market watchers are expecting going forward. What's behind this correction? The U.S. stock market initially jumped after President Donald Trump's election in November on hopes he'd bring lower taxes, less regulation for businesses and other policies that would drive corporate profits higher. All those gains have since disappeared, as Wall Street faces the potential downsides of Trump's White House for the economy. The president has been making announcements on tariffs at a dizzying pace, first placing them on trading partners, then exempting some and then doing it all over again. The tariffs could hit every country that trades with the United States, which would raise prices for U.S. households and businesses when high inflation has already proven stubborn to fully subdue. The fear is that tariffs could slow or even halt the solid growth the U.S. economy was showing when it ended 2024. Even if Trump ultimately goes forward with less painful tariffs, all the uncertainty around the will-he-or-won't-he rollout could prove damaging by freezing economic activity. Such concerns have shown up in the latest readings on consumer confidence, as well as companies' forecasts for future profits. Trump himself has acknowledged his plans could affect the U.S. economy's growth. All the uncertainty is also making things more complicated for the Federal Reserve, which had been cutting interest rates after getting inflation nearly all the way down to its 2% target. Cutting rates further would help the economy, but it could also put upward pressure on inflation. The brunt of this sell-off has also hit stocks that critics were saying looked the most expensive after running wild through the frenzy around artificial intelligence. Nvidia, for example, has already dropped roughly 14% in 2025 so far after surging more than 800% through 2023 and 2024. Most of the other big stocks in the “Magnificent Seven” that have dominated the market recently have also been lagging the rest of the S&P 500. Those seven stocks alone had accounted for more than half the S&P 500’s total return last year. How often do corrections occur? Every couple years, on average. Even during the historic, nearly 11-year-long bull run for U.S. stocks from March 2009 to February 2020, the S&P 500 stumbled to five corrections, according to CFRA. Worries about everything from interest rates to trade wars to a European debt crisis caused the pullbacks. The U.S. market's last correction was in 2023, when the S&P 500 dropped 10.3% from the end of July into October. At the time, high Treasury yields were undercutting stock prices as traders accepted a new normal where the Fed would keep rates high for a while. But stocks would quickly turn higher as optimism revived that cuts to rates were on the horizon. The last correction that did graduate into a bear market was in 2022. That's when the Fed first began cranking up interest rates to combat the worst inflation in generations. Worries rose that high rates would slow the economy enough to create a recession, one that ultimately never came. Through the 2022 bear market, the S&P 500 fell 25.4% from Jan. 3 to Oct. 12. What typically happens after a drop like this? Looking only at corrections since 1946 that managed to right themselves before turning into a bear market, the S&P 500 has taken an average of 133 days to hit bottom and lost an average of nearly 14% along the way, according to CFRA. The index has taken an average of 113 days to recoup its losses. For declines that become bear markets, the damage is much worse. Going back to 1929, the average bear market has taken an average of nearly 19 months to hit bottom and caused a loss of 38.5% for the S&P 500, according to S&P Dow Jones Indices. How bad can a bear market be? On paper, an investor can lose most of their money. From late 1929 into the middle of 1932, the stock market fell a little more than 86%, for example. A bear market can also feel interminable: One lasted more than five years, from 1937 into 1942, where U.S. stocks lost 60%, according to S&P Dow Jones Indices. In Japan, after the Nikkei 225 index set a record at the end of 1989, it sank and then took decades to fully recover. It wasn't until 2024 that it got back to that peak. The Japanese example is an outlier, though. In almost every case, investors would have made back all their losses from a downturn for U.S. stocks if they simply held on and didn't sell. That includes the 2000 dot-com bust, the 2008 financial crisis and the 2020 coronavirus collapse. What should we expect this time? No one knows. Some investors on Wall Street say they expect Trump to pull back on some policies if they prove to be too damaging, while others say the uncertainty alone is creating enough pain. The economy has given signals that it's still relatively solid at the moment, including last month's jobs report, but the outlook looks cloudier than usual given all the unknowns.",negative,negative,negative,neutral,negative
"S&P 500 contracts rose 0.8% as a stopgap funding bill looked set to pass and avoid a US government shutdown. That’s a change in mood after the benchmark index extended its three-week rout beyond 10% on Thursday, the technical threshold for a correction. In Europe, the Stoxx 600 index climbed 0.4%. Kering SA plunged 11% as its choice of designer to oversee a makover at Gucci disappointed investors. In Asia, the CSI 300 index of mainland China stocks touched the highest level this year, on prospects for more policy support to encourage consumption. Treasuries gave back some of the gains from the prior session, when investors dashed to haven assets in a move that lifted gold to a record and supported the dollar. Gains for the greenback extended into Friday, strengthening a gauge of the currency for a third day. The pound weakened Friday after data showed the UK economy unexpectedly shrank at the start of 2025. Gross domestic product fell 0.1% in January, hit by declines in manufacturing and construction. Economists had expected a 0.1% increase. Get the Markets Daily newsletter to learn what’s moving stocks, bonds, currencies and commodities. Washington lawmakers avoiding a government shutdown would remove an uncertainty for traders, already fretting over threats to US economic growth from President Donald Trump’s tariff war. Two months into Trump’s presidency, sentiment on Wall Street has turned from optimism to nervousness. Wall Street’s slump has erased  trillion from US stocks as investors pared risk and some moved money to markets in Europe and Asia. “It’s a very volatile environment and we expect this to continue in the foreseeable future,” Thomas Taw, head of APAC investment strategy for BlackRock, said on Bloomberg Television. He said equity markets “like Europe and to some extent China,” have emerged as compelling opportunities as US shares have fallen from record highs. The recent swoon in US stocks is a technical correction rather than the beginning of a new bear market as it’s likely to prompt policy intervention, according to Bank of America Corp.’s Michael Hartnett. The S&P 500 has plunged 10% into correction territory since a February peak. A bear market is defined as a 20% drop from a recent high. The BofA strategist, who has preferred international equities over the US this year, recommended buying the S&P 500 at 5,300 points, a drop of a further 4% from current levels, once stock outflows accelerate, fund managers’ cash levels rise above 4% and high-yield spreads approach 400 basis points. “We say this is a correction, not a bear market in US stocks,” Hartnett wrote in a note. “Since equity bear threatens recession, fresh declines in stock prices will provoke flip in trade and monetary policy.” Congressional Democrats and Republicans have been engaged in a high-stakes game of chicken over Democrats’ insistence that a spending package include some restraints on Elon Musk’s DOGE’s cost-cutting crusade, with Republicans refusing and daring the opposition party to risk blame for a shutdown. Senate Democratic leader Chuck Schumer dropped his threat to block a Republican spending bill, opening the way to avoid a US government shutdown. Traders are also tracking prospects for a ceasefire in Ukraine. Russian President Vladimir Putin said he wants to discuss a proposed ceasefire with Trump, though he warned that any truce should lead to a long-term resolution of the war. At the same time, the US is tightening sanctions on Russia by restricting payments for energy even as it pursues peace talks. Meanwhile, investors are the most bullish on Treasuries relative to stocks for at least three years, as Trump’s tariff policies threaten to end the era of US exceptionalism, the Bloomberg Markets Live Pulse survey showed. In Asia, consumption stocks drove Chinese shares higher on policy hopes, while banking stocks advanced as investors positioned for a possible reduction in the reserve ratio requirement, which would free up more funds for lending. CK Hutchison Holdings Ltd. plunged Friday after China’s top office dealing with Hong Kong matters reposted a sharp attack on the conglomerate’s decision to appease Trump by selling its stake in Panama ports. Elsewhere, oil advanced as the US tightened sanctions and gold traded within a whisker of ,000-an-ounce. Key events this week: US University of Michigan consumer sentiment, Friday Some of the main moves in markets: Stocks The Stoxx Europe 600 rose 0.3% as of 8:27 a.m. London time S&P 500 futures rose 0.8% Nasdaq 100 futures rose 1% Futures on the Dow Jones Industrial Average rose 0.6% The MSCI Asia Pacific Index rose 0.5% The MSCI Emerging Markets Index rose 0.9% Currencies The Bloomberg Dollar Spot Index was little changed The euro was little changed at .0851 The Japanese yen fell 0.7% to 148.86 per dollar The offshore yuan rose 0.2% to 7.2321 per dollar The British pound fell 0.1% to .2936 Cryptocurrencies Bitcoin rose 2.8% to 2,553.62 Ether rose 3.2% to ,900.86 Bonds The yield on 10-year Treasuries advanced two basis points to 4.29% Germany’s 10-year yield advanced two basis points to 2.87% Britain’s 10-year yield was little changed at 4.67% Commodities Brent crude rose 0.8% to 0.46 a barrel Spot gold was little changed This story was produced with the assistance of Bloomberg Automation. --With assistance from John Cheng and Sagarika Jaisinghani.",positive,positive,neutral,negative,neutral
"You may need to say goodbye to your favorite champagne and cognac.Imported wine, champagne, and other alcoholic products from the European Union are the latest targets of President Trump's tariff threats.On Thursday morning, President Trump posted on Truth Social that if the EU didn't remove a 50% tariff on whiskey, the US would place a 200% tariff on wine, champagne, and other alcoholic products. The whiskey tariff, set for April 1, is part of retaliation for the US putting a 25% tariff on steel and aluminum.If it goes into effect, the whopping 200% tariff could essentially eliminate imports of these types of products in the United States, Needham & Company analyst Gerald Pascarelli told Yahoo Finance.A company is not going to ship it on a 200% tariff, Pascarelli said. The duty also increases the likelihood that you're going to get a global trade war with collateral damage, and that's not going to be good for the sector, he added.Year to date, shares of American whiskey maker Brown-Forman  BF-B , the world's second-largest wine and spirits seller Pernod Ricard  RI.PA , and scotch and spirits maker Diageo  DEO  have dropped 8%, 11%, and 15%, respectively.A spokesperson from Brown-Forman told Yahoo Finance, We are pleased that [European Union] President von der Leyen and Trade Commissioner Šefčovič expressed a desire to negotiate with the U.S. and are hopeful the two sides will reach a constructive resolution before the tariffs take effect on April 1.The tariff conversation is bigger than Brown-Forman and our industry, and it’s evolving rapidly, the spokesperson added.Brown-Forman said it's working closely with spiritsEurope and the Distilled Spirits Council of the United States. LVMH, which owns champagne brands Moët & Chandon and Veuve Clicquot, did not immediately respond to request for comment.Pernod Ricard referred to a statement from spiritsEurope. The trade group said it's deeply alarmed by the renewed threat of tariffs on EU and US spirits — once again, as part of an entirely unrelated dispute. This cycle of tit-for-tat retaliation must end now!Spirits trade exemplifies how open markets create mutual benefits. Reimposing tariffs would be a step backward — hurting businesses, workers, and consumers on both sides, the group added.In 2018, the EU imposed a 25% tariff on American whiskey as part of retaliatory tariffs during the first Trump administration's steel and aluminum tariffs. Given this gives a sense of déjà vu, Pascarelli said the valuation of Brown-Forman shares may have already priced in the risk of tariffs.In January, Tak Niinami, the CEO of Suntory Holdings, which owns bourbon brands Jim Beam, Maker's Mark, and Basil Hayden, told Yahoo Finance at the World Economic Forum, We are preparing for that tariff from the European continent and vice versa. We've been preparing for it because that dispute has been studied well before.In the meantime, champagne and wine lovers may start stocking up.French wines and champagnes are already the most expensive in the market, Pascarelli said. The tariffs would make it prohibitively expensive for almost every consumer. ... You might see some pre-buying right now ... on fear that [the price of] some of their favorite champagne is going to go up.Meanwhile, beer maker Molson Coors  TAP  shares are up 3% year to date, as its US-based production shields it from the risk of tariffs, per Pascarelli.It's a far different story for Constellation Brands  STZ , whose shares are down 17% this year.Tariffs are certainly a headwind to Constellation Brands, he added, as roughly 86% of Constellation Brands' sales are Mexican beer. Constellation Brands imports every single drop of beer that it sells in the United States from Mexico ... that's going to impact their entire beer business.",positive,negative,negative,negative,neutral
"Key Takeaways The S&P 500 tumbled into correction on Thursday as stocks continued to sell off amid growing concerns about tariff risks. Retail investor activity suggests we're in the third of five psychological phases of a typical market downturn, according to analysts at Vanda Research. A disconnect between investor sentiment and behavior has widened in recent weeks; individual investors feel extremely bearish but have reduced their equity exposure only slightly. The political and economic uncertainty that has sent U.S. stocks reeling in recent weeks is making it difficult for investors to predict when stocks will find their footing. Retail investor activity suggests we're in the third of five psychological phases of a typical market downturn, according to analysts at Vanda Research. “Retail behavior around equity market drawdowns looks a lot like an abbreviated version of Kübler-Ross’s Five Stages of Grief model,” analysts Marco Iachini and Lucas Mantle said in a report released Thursday. The sell-off in U.S. stocks intensified on Thursday, sending the benchmark S&P 500 index into its first correction since October 2023. The recent rout has been fueled primarily by uncertainty around President Donald Trump's on-again, off-again threats to impose tariffs, which economists say could spur inflation and weigh on economic growth. The 5 Stages of Stock Market Grief The Vanda analysts break down the stages and their characteristics in the following way: Denial: Retail investors “buy the dip” as analysts argue fundamentals remain strong. Anger: Some retail investors begin to capitulate, and often blame external forces (e.g., bad Fed policy, geopolitics, algorithmic trading). Bargaining: Retail investors begin to accept the downturn, and wait to sell amid relief rallies. Funds rotate into defensive stocks. Depression: Market sentiment hits rock bottom as investors capitulate and draw comparisons to past crises. Acceptance: Volatility subsides as investors begin to reallocate to quality stocks at a discount. So Where Are We Now? Retail trading suggests we’re currently in the bargaining phase, say Iachini and Mantle. Retail investors bought a near-record .85 billion of U.S. stocks on “DeepSeek Monday,” according to Vanda Research data. They bought another .55 billion a week later when Trump first imposed tariffs on Canadian and Mexican goods. These, Iachini and Mantle argue, were denial-driven “buy the dip” moments. Markets may have entered the “anger” phase in February when retail investors scaled back their buying as volatility increased amid tariff uncertainty. Vanda data suggests retail investors started selling during relief rallies in late February, a sign the “bargaining” mentality was prevailing. Concerns about slowing economic growth have encouraged a rotation into the Magnificent Seven and out of small caps, another sign investors are bargaining, not capitulating. The next phase, theoretically, is “depression,” and Iachini and Mantle say some indicators suggest we’re already there; investor sentiment has turned overwhelmingly bearish, according to a weekly American Association of Individual Investors survey. But contrary to typical depression behavior, retail investors haven’t trimmed their equity exposure all that much, according to Vanda data. Institutional investors, meanwhile, are trading like bears. Iachini and Mantle note the last time that happened—in August 2024—improving economic data and encouraging signaling from the Federal Reserve revived bullish sentiment before retail investors followed suit. “The jury is still out on whether today’s sell-off will follow a similar pattern,” they wrote. “A lack of a credible macro (growth) put will shift our focus squarely on retail flows for signs of a market bottom.",positive,negative,negative,negative,neutral
"This is The Takeaway from today's Morning Brief, which you can sign up to receive in your inbox every morning along with: The chart of the day What we're watching What we're reading Economic data releases and earnings The S&P 500 GSPC narrowly entered correction on Thursday, meaning the benchmark index has retreated 10% from its last all-time high on Feb. 19. But whether the S&P 500 has officially reached a technical term used to describe a drawdown is perhaps really neither here nor there. The key question of course is how often sell-offs like this keep getting worse. Friday offered at least a very temporary answer to that with the S&P 500 rising more than 2.1%%, the Dow Jones Industrial Average (DJI) gaining 1.7%, and the Nasdaq Composite IXIC 2.6%. Interestingly enough, research from Carson Group chief markets strategist Ryan Detrick shows that 10% corrections not only happen quite frequently but often end up being the main event instead of extending to a bear market, defined by a 20% drop from an all-time high.Detrick's work shows that since World War II, the S&P 500 has experienced 48 corrections. However, only 12 of those corrections have turned into bear markets, meaning 75% of the time, a correction doesn't spiral all the way down to a bear market. Maybe we go into a correction, but we do not see a bear market coming, Detrick told Yahoo Finance. Early in the post-election year, choppiness is normal and that's kind of what's happening. The swift nature of the recent pullback is also typically a good barometer for how the index bounces out of correction, according to BMO Capital Markets chief investment strategist Brian Belski. In a research note on Friday, Belski highlighted that outside of the pandemic, no correction since World War II that happened as quickly as the current one has led to a bear market. These types of corrections that happen this fast go right back up and recover just as fast, if not more, Belski told Yahoo Finance. He added this makes him very comfortable with his 6,700 year-end target for the S&P 500. In terms of fundamentals, they're still flashing green, not yellow, not red, Belski said. A message that was clear on Friday.",negative,negative,positive,neutral,neutral
