Article,Finetuned_DistilBert_FinancialPhaseBank,FinBert_Sentiment,Grok_Sentiment,Human_Sentiment,Finetuned_DistilBert_FinanceSentimentDataset
"Though the broad outlook for corporate earnings remains strong, analysts have been steadily trimming their expectations for company results in the next 12 months. Profit forecasts for S&P 500 Index companies have seen more downgrades than upgrades for 22 of the past 23 weeks, according to Bloomberg Intelligence, the longest stretch since early 2023. A darkening earnings picture would be an unwelcome development for stock investors, after worries over the economic impact of President Donald Trump’s tariff policies spurred a selloff that has dragged the S&P 500 around 8% from last month’s record. With robust earnings expansion needed to justify the market’s still-elevated valuations, signs that companies may struggle to meet profit expectations in the months ahead could further sour sentiment. The earnings outlook is starting to crack, said Eric Beiley, executive managing director of wealth management at Steward Partners. This drawdown in stocks is signaling to sell-side analysts that they need to bring down their annual profit outlooks even further from here. While first quarter earnings season kicks off on April 11 with a report from JPMorgan Chase & Co. and other banks, some US companies are already sending worrying signals. American Airlines Group Inc. on Tuesday predicted its first-quarter loss would be roughly twice as big as expected, a day after bellwether Delta Air Lines Inc. cut its profit outlook in half, with both carriers citing weakening demand for air travel. Retailers including Kohl’s Corp., Abercrombie & Fitch Co. and Walmart Inc. have also sounded a cautious note. Analysts still see a 10% advance in S&P 500 earnings in 2025, down from a 13% forecast in early January, BI data show. But there may be ample room on the downside: Yung-Yu Ma, chief investment officer at BMO Wealth Management, said analysts will likely need to trim their annual S&P 500 profit estimates for 2025 to the high single-digits to account for the restraint tariffs would put on corporate profit margins. There’s still the risk of estimates falling as more companies guide around Trump’s tariff policies, said Scott Chronert, head of US equity strategy at Citigroup Inc. Others have already reeled in their earnings estimates. David Kostin, chief US equity strategist at Goldman Sachs Group Inc., on Tuesday reduced his full-year earnings growth estimate to 9% from 11%. He now sees the index ending the year at 6,200, down from a previous forecast of 6,500. That would still be a nearly 10% gain from Friday’s close. An earnings picture that grows too bleak could weigh on stocks. Evidence that investors are already bracing for more downside ahead can be seen in the record highs in gold, a popular safe haven. Prices for US government bonds, another popular destination for nervous investors, have risen since mid-February. Keith Buchanan, partner and senior portfolio manager at Globalt Investments, has been selling some large-cap growth shares and raising his cash allocation. It only makes sense to err on the side of caution, he said. Of course, corporate results in recent years have shown resilience in the face of everything from soaring inflation to the highest interest rates in decades. Investors hope Trump will either soften or remove tariffs before they pinch profits. It could also take months before more sell-side analysts and companies guide forecasts lower, according to Michael Casper, equity strategist at BI. Such a scenario played out during Trump’s first term: though the US trade war with China heated up in the early months of 2018, the hit to corporate profits only showed up about a year later, according to BI data. Still, Casper noted that the economy had the tailwind of big corporate tax cuts during that period. Pressure has grown on Trump to push through a sweeping tax bill in his second term, as economic worries mount. For Michael Shaoul, chief executive officer and founding partner at Ion Macro Management, earnings have not figured into the recent selloff, which he said has been driven by investors unwinding overstretched positions in US megacaps and reallocating funds to Europe and Asia. He remains optimistic on corporate profits and the longer term performance of stocks. However, if any negative earnings surprises are injected into the market, things will get more turbulent from here, he said.",positive,negative,negative,neutral,neutral
"China's stock market is suddenly surging after a tough time in 2024. A pro-tech shift from Beijing is spurring confidence in markets. While economic challenges persist, sources say the government is correcting course. China looks investible again. The country's stocks are rallying, countering the notion that investors should avoid the world's second-biggest economy. Though many on Wall Street have been bearish on China since 2023, its stock market is suddenly looking good relative to flagging US peers. Just a year ago, investors fled China in droves as they lost faith in its post-pandemic economy, and the exodus quickly back an ongoing problem for Beijing. Amid fear that China would buckle from deflation, unemployment, or its high debt environment, foreign direct investment last year hit its lowest level since 1992. The CSI 300 Index, a benchmark of mainland shares, dropped over 45% from a 2021 peak to the end of last year. But now, while US stock leaders have suffered big declines since mid-February, Chinese large-caps have achieved their best annual start since 2002. While the S&P 500 is down almost 10% from its February all-time high, the CSI 300 has topped a mid-December high and is up about 5% year-to-date. The moves are causing analysts to start paying attention. Citi recently upgraded China stocks to Overweight, while dropping its view of US stocks to Neutral. Meanwhile, Bank of America has said that the country will outperform this year, predicting that the previously unloved tech stocks will gain ground on sagging US peers. Pro-tech turnaround Before this year, many were skeptical about China's tech environment, which was weighed down by disapproval from Beijing officials. Since 2020, many of the nation's leading tech names have been caught in a regulatory crackdown, making investors hesitant to put money to work. But the government's changing approach toward the industry has been on full display in the past month, starting with President Xi Jinping's supportive remarks at a top tech symposium in February. Pro-business undertones continued in this week's two sessions, a set of concurrent policy meetings that outline the country's economic goals. Ben Harburg, founder of Core Values Alpha, cited Beijing's recent embrace of its tech sector as one of several catalysts behind his firm's upside thesis. Eighteen months ago, his company created the CoreValues Alpha Greater China Growth ETF on the idea that investors have become too pessimistic about China's economy and its tech sector. [Beijing] very clearly said: Our national growth will be driven by technology, Harburg told Business Insider. So it is unequivocal now they will lean in on technology, they will be supportive of technology, will do everything in their power to stimulate, subsidize, de-regulate — whatever is necessary to help technology kind of win. That's an alluring notion for stocks beaten down by an anti-tech narrative in recent years. As of late February, Chinese equities were trading at around a 50% discount compared to the US market. But the perceptions of China's negative view of the space might have been exagerrated, Harburg noted. I don't think the Chinese government was ever an anti-tech as we were led to believe, he said, adding: The world perceives it very differently, because [regulation] happens without any warning, and it and it kind of like just shocks people and throws them off. The crackdown narrative has given Chinese equities room to run higher this year, as it's helped lower valuations which are now moving upward. But it also helped catch US investors by surprise. Starting with China's DeepSeek tool, a flurry of competitive Chinese AI tools have debuted this year, upending confidence in America's leadership in the space and sparking a reevaluation of Beijing's market, Harburg said. As the AI trade has waned in the US this year, China's AI-linked stocks have soared on the back of the latest announcements. Clearly, China is much further along than we were told, Harburg said. An economic turnaround? There are still challenges though, and, so far, Beijing's focus on tech is only a sentiment shift, said Tianlei Huang, a researcher for the Peterson Institute for International Economics. While positive signals were given, this remains a symbolic gesture without new policies. China's private sector—including tech— continues to face the same challenges that have pushed investors away since COVID, while confidence among entrepreneurs and consumers is at post-pandemic lows The reaction in the stock market to this [tech] symposium is, I think, actually a very sad thing, he said. Nothing in substance has really changed in terms of policy, regulations, right? It's just an attitude change. Many of the broader issues that have plagued China's economy are still in play. That includes a highly indebted real-estate sector and downbeat consumers, creating a deflationary environment from which investors have fled since 2023. But Beijing might finally be waking up to this as well. Over the past year, many of its stimulus measures have fallen short as they failed to target domestic consumers, which analysts agree are the linchpin to growth. Yet, during the two sessions, there was a new-found emphasis on domestic demand and private consumption. By Friday, stocks rose as the government urged financial lenders to ease loan terms for consumer borrowers. The shift toward domestic growth comes as China realizes it cannot reach this year's 5% GDP target by depending on trade, Huang said. This was the case last year, as net exports accounted for 30% of GDP. It's not a sustainable number, and it's largely driven by product stockpiling from buyers worried about Washington's trade war. It remains to be seen whether the 5% target is realistic, Huang said, though the sentiment shift is significant and should shape future policy. But Harburg sees things in a much brighter light. Aside from the positive mood in tech, he noted that investor fears about China haven not been realized. There's been no major real-estate crash and improvements are beginning to show in first-tier cities. It doesn't happen for two years, three years, four years. And so the reality is, I think people are finally kind of fatigued with all of these stories that they were told, he said.",positive,negative,positive,neutral,neutral
"(Bloomberg) -- A rebound in stocks faded on speculation the market has run too far, too fast amid risks stemming from a trade war to an economic slowdown and sticky inflation.Following one of its best days in 2025, the S&P 500 fluctuated. Wall Street investors refrained from making big bets on Tuesday, with a slide in consumer confidence to a four-year low weighing on sentiment. That’s even as traders added to bets on Federal Reserve rate cuts in 2025. Bond yields slipped. The dollar halted a four-day advance. Oil fell as US said Russia and Ukraine have agreed to a ceasefire in the Black Sea. US copper surged to a record. Subscribe to the Stock Movers Podcast on Apple, Spotify and other Podcast Platforms. Market forecasters have been split on whether the rebound in equities has further to go. Strategists at HSBC Holdings Plc led by Max Kettner downgraded their rating on US stocks to underweight, citing economic concerns. Meantime, JPMorgan Chase & Co.’s Ilan Benhamou said it’s time to pause the rally-fading approach as emerging clarity on tariffs alleviates some key risks. To Matt Maley at Miller Tabak, the stock market’s bounce from a selloff has been a good one, but it investors need to be convinced that the worst is really behind us. In other words, this bounce is nothing more than something you would normally see after a correction, he noted. The S&P 500 was little changed. The Nasdaq 100 rose 0.2%. The Dow Jones Industrial Average wavered. Most megacaps advanced, though Tesla Inc. and Nvidia Corp. halted their rallies. KB Home sank after cutting its sales forecast. The yield on 10-year Treasuries slid three basis points to 4.30%. The dollar dropped 0.2%. Consumer sentiment surveys from The Conference Board and University of Michigan have been dismal of late as households fear a resurgence in inflation from President Donald Trump’s tariffs. Companies have warned of higher prices and less demand, coinciding with economists’ forecasts that suggest a risk of stagflation and rising odds of recession.Sentiment continues to wane among investors, consumers and businesses as economic concerns and economic policy uncertainty takes its toll, said Bret Kenwell at eToro. Until there’s more certainty on the tariff and macro front, sentiment and confidence remain vulnerable. At UBS Group AG, Bhanu Baweja said the visibly tiring US consumer is set to further pressure stock prices. He expects the S&P 500 to drop as low as 5,300 points as analysts cut profit estimates for the next three to four months. The gauge hovered near 5,770. Over the last several weeks we’ve seen evidence that whatever froth there was in terms of market sentiment, bullish sentiment has been wrung out, said Bespoke Investment Group strategists. They noted the latest example came in Tuesday’s consumer confidence, with the percentage of those expecting lower stock prices in the year ahead surging by more than 10 percentage points. Following these prior surges in negative sentiment, though, the equity market tended to start recovering, and pretty quickly in most cases, Bespoke said. For much of last year, market forecasters bumped up their outlooks for US equities in tandem, chasing a rally that propelled the S&P 500 from one record high to another. But a quick 10% drop from the index’s February high caught them offsides, triggering a debate over which way stocks will go next. Of course, the benchmark has bounced back in recent days as the White House signaled plans to take a more targeted approach to the tariffs coming next week. However, the ultimate outcome remains highly unpredictable since levies from the US are likely to trigger reciprocal responses from the countries they’re aimed at, making the economic consequences almost impossible to predict. The issue at this point is the risk/reward is much less favorable than when the S&P 500 was around 5,500-5,600, said Jonathan Krinsky at BTIG. So in order to be aggressive buyers here, you have to believe the S&P 500 is going back above 6,000. While we are open to that possibility, it’s not our base case.",negative,negative,negative,negative,negative
"More trouble for Tesla (TSLA) in Europe and the UK, its third biggest region, as a combination of heightened competition, a key product changeover, and CEO Elon Musk’s polarizing politics weigh on sales. Still, one of Wall Street's Tesla biggest fans remains bullish. The European Automobile Manufacturers’ Association (ACEA) reports Tesla’s registrations — a close proxy for sales — in the EU, UK, and European Free Trade Association (EFTA) fell 40.1% in February, to 16,888 EVs. Over the span of January and February, Tesla EV registrations are down 42.6% (26,619). Meanwhile, the ACEA reports total EV registrations are up for those regions, hitting 164,646 units, an increase of 26.1% compared to a year ago, and up 31.4% including January (330,584). After a big pop to start the week, Tesla stock fell in early trading on Tuesday. Europe, there was always going to be increasing competition there, RBC analyst Tom Narayan said in a live interview on Yahoo Finance this morning. (See video above) He added that there’s also heightened competition in China, Tesla’s second biggest region behind the US. But Narayan, a Tesla bull with an Outperform rating and 20 price target on the stock (though he did cut this from 40 last week), says Tesla is poised to overcome the weakness. They do have two new models — the Model Y refresh [and] the new affordable car coming, which could potentially help stem some of these losses, he said. Narayan signaled that he’s not too worried about Tesla’s EU sales, noting that Tesla is about half the total US EV market and adding that the sales data is actually higher in the US for the first two months of the year, though S&P registration data for January said Tesla’s metrics were lower.Narayan did not address the elephant in the room — Elon Musk’s tumbling popularity in both the US and Europe, where his political endorsements of far-right movements have alienated a wide swath of EV-interested buyers. With that said, Narayan’s bullish take on Tesla extends to the overall industry, where EV penetration is low, which can help all automakers, even Tesla. But remember: EVs are still relatively underpenetrated globally, so it could be a rising tide lifts all boats when it comes to car sales, Narayan said. Indeed, at least for Europe, while EV registrations were higher, petrol or gas-powered car sales were down 21.9% for the first few months of the year. The true test of Tesla sales and registrations will be results from the month of March, when the refreshed Model Y went on sale. Investors will get some insight into those numbers when Tesla reports first quarter deliveries next week. ",negative,negative,negative,neutral,negative
"Investors are betting on new Intel (INTC) CEO Lip-Bu Tan to turn around the troubled chipmaker. While it's unclear whether Intel's financial problems can be fixed quickly, Wall Street analysts — and current and former employees — generally agree on what steps Tan needs to take, short of a breakup. Those steps include everything from cutting jobs to turbocharging Intel's young foundry business. A semiconductor industry veteran, Tan was appointed to his new role on March 12. Investors applauded the news: Intel stock rose more than 15% the next day. Analysts liked Tan's experience as former CEO of Cadence Design Systems, a semiconductor design software company, and his experience on boards of some 14 semiconductor companies, including Intel.Now the hard part. Tan is inheriting a company whose financial losses have made it a takeover target in recent months. Many Wall Street analysts and investors believe Intel — which is the only American leading-edge chip manufacturer — would be better off splitting up and selling its struggling manufacturing business. Case in point: The stock has risen on various reports in recent months of potential deals, some of which were allegedly being worked on with the support of the Trump administration. Reuters reported last week that Tan plans to keep Intel's manufacturing business running for now and is looking to bolster Intel's faltering AI chip efforts to catch up to Nvidia (NVDA). He said as much in a letter to employees on March 12: Together, we will work hard to restore Intel's position as a world-class products company, establish ourselves as a world-class foundry and delight our customers like never before. Read more about Intel's stock moves and today's market action. Yahoo Finance interviewed four Wall Street analysts and nine current and former Intel employees — including high-level executives. The employees were granted anonymity due to nondisclosure agreements and fear of jeopardizing future employment opportunities. Some of those sources said Intel should be left in one piece, at least for now. That's because, if split up, Intel's foundry would immediately go bankrupt, Bernstein analyst Stacy Rasgon told Yahoo Finance. And Intel's product business, which designs the chips, can't outsource to rival manufacturers so easily — Intel semiconductors are specifically made in accordance with its own internal manufacturing processes. Not to mention, Intel's billions in CHIPS Act funding requires it to retain majority ownership of its foundry. Intel declined to make Lip-Bu Tan available for an interview but told Yahoo Finance: Lip-Bu is spending a lot of time listening to customers and employees as he comes on board and works closely with our leadership team to position the business for future success. Here's what company sources and Wall Street analysts said he has to do to to avoid a break up. 1. More business to the foundry Intel is one of the few remaining chipmakers that both designs and makes its own chips. On the design side, Intel has fallen behind rivals such as AMD (AMD) and, of course, Nvidia in an increasingly AI-dominated industry. On the manufacturing side, Intel has repeatedly faced delays.Former CEO Pat Gelsinger attempted to grow Intel's revenue by opening its in-house manufacturing business — a foundry — to outside customers on a large scale. Foundries such as Taiwan's TSMC (TSM) produce chips for other companies. Intel historically produced chips for its internal product business before Gelsinger launched Intel Foundry Services (IFS) in 2021. The foundry strategy had mixed results. Intel is set to achieve a big feat by launching a new advanced chip manufacturing process called 18A this year, and IFS has deals with Amazon (AMZN) and Microsoft (MSFT). But analysts debate whether Intel can sustain the foundry, which lost 3.4 billion on 7.5 billion in revenue in 2024. Bottom line: Intel needs to attract more big outside customers. Analysts and former executives said Tan's industry connections should help, but his credibility alone won't guarantee success. In order for Intel's manufacturing business to survive, the company must succeed in launching 18A. While Intel manufacturing employees had previously suggested that the new technology was having trouble, those same employees said this week that 18A is progressing — and Intel manufacturing staff is feeling positive about its success. As Moor Insights & Strategy analyst Anshel Sag said: [I]f the results are good and companies are happy, they'll increase their capacity at the foundry. 2. Be patient and 'learn from deploying' Per Reuters, Tan is looking to boost Intel's AI chip efforts to rival Nvidia and others. Intel fumbled multiple attempts to enter what would become the AI chip market. In 2009, Intel scrapped a multiyear project, Larrabee, to develop a standalone GPU like Nvidia's. In 2017, Intel hired AMD's graphics chip engineer, Raja Koduri, to lead a second effort toward a homegrown GPU, which ultimately failed. And in January Intel effectively killed its most recent effort, a high-end AI GPU called Falcon Shores.Intel has a very good finance organization, but the company does sometimes make these decisions that are overly led by the early years' financial outcome, said a former high-level executive. You only learn from deploying. If you intend to be in that market long term, you might as well have access to the market, even if it costs you through the first generation. 3. Revitalize 'Team Blue'? Former and current Intel employees describe the company, whose staffers refer to themselves as Team Blue, as slow and bureaucratic. Past high-level executives said the chipmaker's new CEO will need to shake up company culture and cut middle management. It's a tough balancing act. The two current employees said any layoffs could depress morale and risk slowing the progress of 18A. Tan already has said Intel has hard decisions ahead. One of the employees said their colleagues are bracing for a potentially huge amount of layoffs in the second or third quarter. They said their teams are already understaffed, and cuts to middle management would result in those teams being moved around, creating chaos. One of the high-level former executives said, The depth of talent at Intel is immense, and the loyalty that people have is astounding, later adding, The answer lies in inspiring the people you have.",positive,negative,neutral,neutral,neutral
