Article,Finetuned_DistilBert_FinancialPhaseBank,FinBert_Sentiment,Grok_Sentiment,Human_Sentiment,Finetuned_DistilBert_FinanceSentimentDataset
"(Bloomberg) — A global stocks selloff fueled by concerns about the American economy eased as US equity futures signaled modest gains on Wall Street. Bitcoin was poised to snap five days of losses.Contracts for the S&P 500 were up 0.4% after the benchmark index fell the most this year on Monday. Those on the Nasdaq 100 rose after the gauge’s deepest slump since 2022. Europe’s Stoxx 600 index was steady. Asian shares bounced off an intraday five-week low. The euro strengthened 0.6% amid optimism lawmakers in Germany will reach an agreement over defense spending. A gauge of the dollar fell. Yields on policy sensitive two-year Treasuries pared a drop to the lowest level since October. The mood in markets remains nervous after Wall Street investors tempered their bullish views due to concerns that tariffs and government spending cuts will hit US growth. There’s also an increasing view that President Donald Trump won’t intervene to support the market, while the Federal Reserve has signaled it’s in no rush to adjust interest-rate policy. “In the short-term, it remains difficult to advocate buying dips, with the bear case holding more weight,” said Michael Brown, senior research strategist at Pepperstone. “Growth expectations continue to slide, dragging earnings expectations lower alongside, all the while policy uncertainty clouds the outlook, and as a ‘Fed put’ remains about as elusive as one from the White House.” In the US Monday, the S&P 500 dropped 2.7%. The Nasdaq 100 lost 3.8%. In the megacap space, Tesla Inc. sank 15% while Nvidia Corp. drove a closely watched gauge of chipmakers to the lowest since April. About 10 high-grade companies delayed US bond sales. Citigroup Inc. strategists downgraded US stocks to neutral from overweight while upgrading China to overweight, saying US exceptionalism is at least on pause. Citi raised China to overweight as the country looks attractive even after a recent rally. Earlier, HSBC strategists raised their rating on European equities, excluding the UK, to overweight from underweight as they expect euro-zone fiscal stimulus to be “a potential game-changer.” Get the Markets Daily newsletter to learn what’s moving stocks, bonds, currencies and commodities. Investors have been increasing hedges by shorting futures and options, and that often exacerbates selling, said Rajeev De Mello, a global macro portfolio manager at Gama Asset Management. Even after Monday’s rebound, De Mello said he remains wary. “I remain cautious as investor sentiment has turned increasingly risk-averse,” he said. Bitcoin erased a decline of as much as 3.4% to climb 1.9%. Oil steadied after a decline while gold gained. Key events this week: Japan GDP, household spending, money stock, Tuesday US job openings, Tuesday Canada rate decision, Wednesday US CPI, Wednesday Eurozone industrial production, Thursday US PPI, initial jobless claims, Thursday US University of Michigan consumer sentiment, Friday Some of the main moves in markets: Stocks The Stoxx Europe 600 was little changed as of 8:36 a.m. London time S&P 500 futures rose 0.4% Nasdaq 100 futures rose 0.5% Futures on the Dow Jones Industrial Average rose 0.3% The MSCI Asia Pacific Index fell 0.7% The MSCI Emerging Markets Index fell 0.4% Currencies The Bloomberg Dollar Spot Index fell 0.3% The euro rose 0.6% to .0899 The Japanese yen was little changed at 147.18 per dollar The offshore yuan rose 0.4% to 7.2329 per dollar The British pound rose 0.3% to .2924 Cryptocurrencies Bitcoin rose 2.1% to 0,927.99 Ether rose 2% to ,906.22 Bonds The yield on 10-year Treasuries declined two basis points to 4.19% Germany’s 10-year yield advanced two basis points to 2.86% Britain’s 10-year yield was little changed at 4.64% Commodities Brent crude rose 0.4% to 9.54 a barrel Spot gold rose 0.6% to ,906.91 an ounce This story was produced with the assistance of Bloomberg Automation. —With assistance from Abhishek Vishnoi, Jason Scott and Robert Brand.",positive,positive,neutral,neutral,positive
"Lip-Bu Tan, who is set to take over as Intel’s chief executive next week, is a veteran of the semiconductor industry who has an even longer track record as a technology investor, particularly in Chinese companies.

A former Intel board member, Tan will lead a once-venerated U.S. company that has seen its fortunes fall as the artificial-intelligence boom prompted a shift in industry demand away from its central processing chips.

Most Read from The Wall Street Journal
CEOs Don’t Plan to Openly Question Trump. Ask Again If the Market Crashes 20%.

One of the Biggest Victims of Trump’s Metals Tariffs: The Ford F-150

Is Trump Taking a ‘Liquidationist’ Approach to the Economy?

L.A. Has Big Plans to Rebuild After the Fires. Good Luck Getting Insurance.

Intel Names Lip-Bu Tan as Chief Executive Officer

Here are five things to know about Tan and Intel.

Semiconductor titan
Tan, 65, has risen to become a titan in the semiconductor business, receiving a top honor in 2022 from the Washington-based Semiconductor Industry Association.

Tan gained fame during his tenure leading Cadence Design Systems—which provides software and services to develop chips and other core technologies—from 2009 to 2021. He helped to turn around the company, focusing on what Intel said was customer-centric innovation that helped double revenue and expand margins.

“Cadence was in pretty big trouble” in 2009, Morris Chang, the chairman of chip titan Taiwan Semiconductor Manufacturing Co., said in a tribute to Tan in 2016. “Lip-Bu led Cadence out of the trouble.”

Walden founder
Before Cadence, Tan was widely known as a venture capitalist.

Tan, who has a master’s degree in nuclear engineering from the Massachusetts Institute of Technology and an M.B.A. from the University of San Francisco, founded Walden International in 1987 and focused on startups in Asia. The company’s name stemmed from Tan’s fascination with the “contrarian thinking” of American essayist Henry David Thoreau, who wrote about Walden Pond in Massachusetts, according to a 2004 article in Businessweek.

Walden was an early investor in Semiconductor Manufacturing International, eventually investing more than 0 million in the Chinese chip giant. Tan served on the board of that company and China’s Advanced Micro-Fabrication Equipment, and he has been a fixture at Silicon Valley events hosted by the professional group Chinese-American Semiconductor Professional Association.

He served two years on the board of SoftBank Group, whose Vision Fund has been a mammoth investor in Silicon Valley in recent years.

Walden and China
Tan’s extensive ties to China have made him the target of scrutiny from Washington. Walden has backed Chinese technology companies in critical sectors such as semiconductors and AI.

In 2023, the House Select Committee on the Chinese Communist Party sent a letter to Tan raising “serious concern” about Walden’s investments in semiconductor, quantum-computing and artificial-intelligence companies in China, including some that the Commerce Department has blacklisted for involvement in human-rights abuses or Chinese military uses. A report from the same committee found that Walden’s internal documents cited the Chinese government’s prioritization of semiconductors as a reason to invest in the sector.

A Wall Street Journal report in 2021 found that Walden made at least 25 investments in Chinese chip companies from 2017-20, accounting for more than 40% of the Chinese semiconductor deals involving U.S. venture investors during that period.

Intel breakup?
The chipmaker’s shares rose by more than 10% in after-hours trading Wednesday. While Intel’s shares have languished in the last 12 months, its performance has been propped up by investor speculation that it could break up its manufacturing and product businesses.

The Journal reported last month that TSMC and Broadcom had preliminary discussions about deals, with TSMC having an interest in controlling Intel’s chip plants. Intel executives said they would create a separate board for the manufacturing business, a move some analysts saw as having the potential to lead to a breakup.

“The key question is whether Lip-Bu will keep product and foundry business together or go for a split,” Raymond James analyst Srini Pajjuri said.

Broadcom’s CEO said this week that he wasn’t currently pursuing any acquisitions.

California ties
“There’s nothing I dislike more than losing,” Tan said Wednesday in a message to employees, noting that he learned as an athlete in college to trust his teammates.

Born in what is now Malaysia and raised in Singapore, he has served on a number of community and other boards in California, including the University of California, San Francisco Health System’s executive council, the Fuller Theological Seminary and at Carnegie Mellon University.

He has been an elder at the First Presbyterian Church of Berkeley and served with former Intel CEO Pat Gelsinger as a “cabinet member” for Transforming the Bay With Christ, a nonprofit organization.

“I enjoy swimming, snow skiing, fly fishing, hiking, and spending time with my family and church,” Tan said in his bio at Walden Catalyst, an early-stage venture firm Tan founded.",positive,neutral,neutral,neutral,neutral
"As gold races to new records, Wall Street analysts have rushed to raise their price targets, with the latest call from Macquarie Group predicting the precious metal will touch ,500 in the third quarter. On Thursday, gold futures (GC=F) climbed above ,990 per ounce as a trade war intensified and the release of modest inflation data raised questions about whether the Federal Reserve may be more inclined to cut rates this year.Year-to-date, gold has been running ahead of our expectations, Marcus Garvey, head of commodities strategy at Macquarie, wrote on Thursday. We are raising our gold price forecast to a 3Q25 quarter average peak of ,150 per ounce and our single point price high to ,500 per ounce,Garvey wrote.President Trump's rapid move to announce, if not always to enact, import tariffs has contributed to geopolitical uncertainty and boosted inflation expectations, helping push down front-end real rates and supporting gold in the face of periodic USD strength and initially reduced expectations for Fed rate cuts, the strategist wrote.Read more: What Trump's tariffs mean for the economy and your walletThe target raise comes after strategists at BNP Paribas called for prices to push above ,100 per ounce in the second quarter.The Trump administration issuing a slew of tariff threats and the realigning of international relationships have added a new layer of macroeconomic and geopolitical uncertainty, providing a significant boost to gold, BNP's David Wilson wrote in a note on Wednesday.Gold futures have rallied more than 11% year to date, hitting multiple record highs since January.Wall Street has attributed much of these gains to continued central bank buying and tariff uncertainty, including the possibility that even imports of the precious metal into the US won't be spared.Institutional investors have shipped elevated amounts of physical gold bars to vaults in New York in a move to front-run tariffs and take advantage of a price disparity between London and New York.Last month, Goldman Sachs analysts raised their year-end gold price forecast to ,100 per ounce, up from their prior projection of ,890.",positive,positive,positive,positive,positive
"(Bloomberg) -- It was only three weeks ago that exuberance over Donald Trump’s blueprint for the economy had vaulted US stocks to a record high. Today, with concern mounting over the goals and impact of his trade war, the S&P 500 tumbled into its first 10% correction in almost two years.Volatility surged anew across US asset classes Thursday, extending a retreat from risk that has lopped  trillion from the US equity benchmark and shows signs of seeping into high-yield bonds. New salvos in President Trump’s tariff offensive spurred another race for havens in the Treasury market.

The S&P 500 — perched at a record as recently as Feb. 19 — slid to a six-month low. This year’s selloff in the megacaps deepened, amplifying the moves. And speculative corners on Wall Street from unprofitable tech to the most-shorted shares got crushed. An  billion exchange-traded fund tracking junk bonds saw one of its biggest losses in 2025, bucking the rise in Treasuries.

In another sign of a trade-war escalation, Trump threatened to enact a 200% tariff on European wine, champagne and other alcoholic beverages. Later Thursday, Trump said he would not repeal tariffs on steel and aluminum that took effect this week, nor back off plans for sweeping reciprocal tariffs on global trading parters set to start as soon as April 2.

“In only a few weeks, the broader market has gone from record highs to correction territory,” said Adam Turnquist at LPL Financial. “Tariff uncertainty has captured most of the blame for the selling pressure and is exacerbating economic growth concerns.”

Former Treasury Secretary Steven Mnuchin discounted risks of a US recession, and played down the current selloff in equities, advising investors against overreacting to President Trump’s aggressive trade tactics.

“We came in with the market being fully priced, so I think a 5% to 10% correction on the S&P or the Nasdaq actually makes sense,” Mnuchin said in an interview with Bloomberg’s Saleha Mohsin Thursday.The S&P 500 fell 1.4%. The Nasdaq 100 slid 1.9%. The Dow Jones Industrial Average dropped 1.3%. A gauge of tech megacaps lost 2.5%. Adobe Inc. sank on a disappointing outlook, while Intel Corp. surged after naming an industry veteran as its next chief.

The yield on 10-year Treasuries fellfive basis points to 4.26%. A 2 billion US sale of 30-year bonds was weak. The dollar rose 0.1%.

US Shutdown Odds Increase as Democrats Dig In Against GOP Bill

“After the election, we framed the likely impact of economic policies from Donald Trump’s second presidential administration as a mix of vegetables and dessert,” said Libby Cantrill and Allison Boxer at Pacific Investment Management Co. “Some policies could leave a bitter taste for the economy and markets – i.e., the vegetables – while others would support growth, the so-called dessert.”

“The net economic impact of the Trump administration’s second term will likely depend on the sequencing, scope, and mix of all of these policies, with risks to both the upside and downside,” they added.

Trump used markets as a litmus test for the success of his first administration, and relished in the gains posted after his victory in November.

But the stark shift from economic optimism is creating an unsettling reality for traders trying to figure out where America’s markets go from here. One major question: At a time when it’s easier than ever for people to see fluctuations in their day-to-day net worth, can a stock rout take the US economy down with it?

“Clearly this is going to be a much more volatile year and it remains to be seen if all of the revolutionary changes to the economy and trans-Atlantic alliances will lead to a recession or if it will lead to higher growth rates in the future,” said Chris Zaccarelli at Northlight Asset Management. “In the meantime, a more cautious and risk-off posture is warranted.”

“There are immediate and looming questions about how much more pain the equity market might endure,” said Michael Purves at Tallbacken Capital Advisors. “Do we buy this dip (down 10% from the peak)? Or do we sell into relief rallies such as we had yesterday?”

In a note, he highlights that there are various “technical bearish signals” that are converging in the same manner as they did in the first quarter of 2022.

“These are just technical signals, and the market risks and macro backdrop today are very different from what they were in 2022,” he said. “However, in a market environment that lacks clarity, these technical signals take on a greater prominence.”

As a reminder, Purves notes, the 2022 bear market was driven entirely by P/E contraction, not falling earnings.

“Prospectively, the market needs to figure out two things: (1) will valuation need to be re-rated to a lower range to account for policy/economic/inflation uncertainty, and (2) will earnings start falling?” he said. “If we get a concurrence of falling earnings and P/E re-rate, then the probability of the SPX selling off to 4,800 will become much higher.”

“Market fears remain at the forefront,” said Bespoke Investment Group strategists. “Investor sentiment also remains very weak.”

Bespoke cited the latest weekly poll from the American Association of Individual Investors, which showed that bearish sentiment was above 55% for the third straight week. The only other time since 1987 that bearish sentiment was above the ‘speed limit’ was in the three weeks ending March 4, 2009, the Bespoke strategists noted.

The flip side of souring sentiment is that it could be a contrarian indicator for markets, noted Jeff Schulze at ClearBridge Investments.

“Surging policy uncertainty has dented consumer and investor sentiment, raised inflation expectations and stalled the equity market rally, he said. “Should policy uncertainty ebb in the coming months, we believe risk assets will rebound.”

While the sharp drop in equity markets has been painful, Turnquist at LPL Financial says the downside rate of change and current drawdown is nothing out of the ordinary.”

Since 1950, 92% of trading days are accompanied by some degree of a drawdown on the S&P 500 (roughly 8% of days have been record highs), he said. A selloff inside of 5% is the most common, occurring in around 40% of all trading days.

“Swift drawdowns also create oversold conditions, and we are beginning to see signs of the broader market reaching washed-out territory,” he said. “However, the damage to longer-term breadth, lack of institutional participation, and defensive rotational pressures leave us cautious on buying the dip right now.”

Ed Yardeni of eponymous firm Yardeni Research has lowered his year-end estimate on the S&P 500, with the best-case target cut to 6,400 from 7,000. The worst-case goal stands at 5,800.

“We continue to bet on the resilience of the economy. However, we acknowledge that it is being severely stress-tested now by Trump 2.0’s tariff turmoil and shotgun approach to paring the federal workforce,” he said.

Earlier in March, Yardeni raised the probability of a US recession this year to 35% from 20%.

US equities are pricing in a recession risk much bigger than credit markets, leaving room for a positive surprise, according to JPMorgan Chase & Co. strategists including Nikolaos Panigirtzoglou and Mika Inkinen wrote in a note.

“While there is clearly elevated uncertainty in the near term as the Trump Administration has at least initially prioritized more disruptive polices, the risk is that credit markets are proven right,” they said.

“The Treasury market is flirting with recession signals, helping amplify the risk-off sentiment in equities, while at the same time sending an alternative message of relative calm with relatively tight credit spreads,” according to Gina Martin Adams and Michael Casper at Bloomberg Intelligence.

Notably, the Federal Reserve’s Treasury-based recession model flagged year-ahead recession risk a year ago, and may be proven right if tariff uncertainty continues to hamper economic activity, they said. Historically, a model reading exceeding 30% has accurately predicted recession one year out. And the current probability is 29.76%.

“The credit model’s implied probability continues to hint at a much calmer economic climate,” they noted. The indicator’s probability for recession was above 10% for most of the past two years and now sits at 13% — still just shy of suggesting a recession is in the cards.”",positive,positive,negative,negative,neutral
"Investors with a longer time horizon may not be running and hiding amid the market's March sell-off. At least not yet. We see a range of emotions among our clients, from nervousness to a focus on the long term, Charles Schwab  SCHW  CEO Rick Wurster told me and Madison Mills on Yahoo Finance's Catalysts  video above . If we look specifically at what our clients are doing, we look at things like margin activity — it's a good pulse for what our more active traders are doing. And our level of margin has stayed roughly the same over the last month, and our margin clients have actually bought equities in the last week. So I think clients are generally hanging in there at the moment. Wurster took over as CEO of Schwab in January after serving as its president. He arrives at an important juncture for markets and the iconic wealth manager. Fresh economic data for consumer confidence from the Dallas Fed survey has painted a picture of increasingly cautious consumers and businesses. Walmart  WMT  is seeing its lower-income shoppers fret once again about inflation, new research reveals. The latest Consumer Price Index  CPI  showed an economy continuing to battle inflationary headwinds before the onset of any tariff-related pressure. Listen: How Edward Jones CEO sees the markets. The market is moving violently as it aims to price in a first-half growth slowdown. The Dow Jones Industrial Average  DJI , S&P 500  GSPC , and Nasdaq Composite  IXIC  are each down 5% in March alone. Led by plunges in large-cap tech names such as Nvidia  NVDA  and Tesla  TSLA , the Nasdaq is down the most in March, with a 5.2% drop as investors sell off risk. On the year, the Nasdaq is down nearly 8.6%, the S&P 500 is off by 4.8%, and the Dow 2.8%.I think there's a variety of [investor] concerns. I think you've seen the market turn or worry about growth... When you look at investors broadly, I think the biggest concern on their mind is just a softer growth picture, Wurster said. After dealing with challenges from migrating TD Ameritrade clients to Schwab's platform for much of 2024, the company began to stabilize in the fourth quarter. Results were also helped by strong trading activity ahead of Election Day and following President Trump's win.Read more: Create a stock investing strategy in 3 steps Fourth quarter revenue rose 20% year over year. Adjusted earnings per share  EPS  improved 49%. Trading revenue advanced 14% from the prior year. Revenue was up 4% year over year for full year 2024; adjusted EPS was up 4% as well.Wurster said any issues related to the Ameritrade platform migration are in the rearview mirror. He adds the company is now eyeing a potential crypto product launch this year, but declined to share further details. We think 2025 presents another step forward in a return to normal for Schwab, JPMorgan analyst Ken Worthington wrote in a client note.We see clear tailwinds for Schwab with conducive backdrop in rates/macro and improving fundamentals.Worthington rates Charles Schwab shares an Overweight  Buy equivalent  with a 3 price target. Shares are down 3% on the year. Robinhood  HOOD  and Interactive Brokers  IBKR  have seen a 5% and 1% gain this year, respectively.",positive,positive,neutral,neutral,neutral
